id,name,objectType,country,regon,countryCd,pib,institutionUuid,lNumber,managerName,eMail,nip,www,iKindName,postalCd,bNumber,phone,iStartDT,dataSource,status,statusCode,city,siTypeName,street,voivodeship,lastRefresh,krs,institutionUid,siTypeCd,uTypeCd,voivodeshipCode,addresses,supervisingInstitutions,statuses,types,names
d3906663-a33e-43d8-81ef-40a67be620e3,Instytut Filozofii i Socjologii Polskiej Akademii Nauk,REPORTS_INSTITUTION,Polska,000325759,167,0,d3906663-a33e-43d8-81ef-40a67be620e3,,Valentina,,5252100471,http://www.ifispan.pl,,00-330,,22 65 72 882,,POLON,Działająca,1,Warszawa,instytut naukowy PAN,ul. Nowy Świat,mazowieckie,1750836896946,,bm_cuTB_YWH5xfD9A4eEzLg,2,,7,Polska | mazowieckie | Warszawa | 00-330 | ul. Nowy Świat |  |  | 1956-09-03,2cc8ed07-3c06-47d4-b26a-64ab1f5df6eb | Polska Akademia Nauk | 1956-09-03,Działająca | 1956-09-03,instytut naukowy PAN | 1956-09-03,Instytut Filozofii i Socjologii Polskiej Akademii Nauk | 1956-09-03
1306e042-f103-4b72-aa6e-0dd3cea395b5,Instytut Fizjologii i Patologii Słuchu,REPORTS_INSTITUTION,Polska,011692096,167,0,1306e042-f103-4b72-aa6e-0dd3cea395b5,,Henryk,,5261744423,http://ifps.org.pl,,02-042,,22 356 03 66,,POLON,Działająca,1,Warszawa,instytut badawczy,ul. Maurycego Mochnackiego,mazowieckie,1750836896991,0000086236,bVyqrRKyfiKxfiyIqfIvjmw,1,,7,Polska | mazowieckie | Warszawa | 02-042 | ul. Maurycego Mochnackiego |  |  | 1996-01-09,e32dba3a-b2a3-41da-8019-314f1091d013 | Minister Zdrowia | 1996-01-09,Działająca | 1996-01-09,instytut badawczy | 1996-01-09,Instytut Fizjologii i Patologii Słuchu | 1996-01-09
30312732-6777-4ca9-84e6-ad3f07bc18c2,Instytut Fizjologii i Żywienia Zwierząt im. Jana Kielanowskiego Polskiej Akademii Nauk,REPORTS_INSTITUTION,Polska,000325989,167,0,30312732-6777-4ca9-84e6-ad3f07bc18c2,,Andrzej,,5250009105,http://www.ifzz.pl,,05-110,,22 7653301,,POLON,Działająca,1,Jabłonna,instytut naukowy PAN,ul. Instytucka,mazowieckie,1750836894811,,bdue8IYFHJjfPMqPlXSYxbA,2,,7,Polska | mazowieckie | Jabłonna | 05-110 | ul. Instytucka |  |  | 1955-07-02,2cc8ed07-3c06-47d4-b26a-64ab1f5df6eb | Polska Akademia Nauk | 1955-07-02,Działająca | 1955-07-02,instytut naukowy PAN | 1955-07-02,Instytut Fizjologii i Żywienia Zwierząt im. Jana Kielanowskiego Polskiej Akademii Nauk | 1955-07-02
8471ef1c-c23a-48a6-89be-6b4559037063,Instytut Fizjologii Roślin im. Franciszka Górskiego Polskiej Akademii Nauk,REPORTS_INSTITUTION,Polska,356730850,167,0,8471ef1c-c23a-48a6-89be-6b4559037063,,Anna,,6772212521,http://ifr-pan.edu.pl,,30-239,,12 425 18 33,,POLON,Działająca,1,Kraków,instytut naukowy PAN,ul. Niezapominajek,małopolskie,1750836896902,,bSdY7AtSClKNL0PqEtrSTTw,2,,6,Polska | małopolskie | Kraków | 30-239 | ul. Niezapominajek |  |  | 1956-11-15,2cc8ed07-3c06-47d4-b26a-64ab1f5df6eb | Polska Akademia Nauk | 1956-11-15,Działająca | 1956-11-15,instytut naukowy PAN | 1956-11-15,Instytut Fizjologii Roślin im. Franciszka Górskiego Polskiej Akademii Nauk | 1956-11-15
41b42e85-449a-4692-994b-a2b74353f099,Instytut Fizyki Jądrowej im. Henryka Niewodniczańskiego Polskiej Akademii Nauk,REPORTS_INSTITUTION,Polska,000326983,167,0,41b42e85-449a-4692-994b-a2b74353f099,,Tadeusz,,6750000444,http://www.ifj.edu.pl/,,31-342,,12 662 8200,,POLON,Działająca,1,Kraków,instytut naukowy PAN,ul. Eljasza Walerego Radzikowskiego,małopolskie,1750836896885,,bdkLR6wGCrp59lwUjwb_dMA,2,,6,Polska | małopolskie | Kraków | 31-342 | ul. Eljasza Walerego Radzikowskiego |  |  | 1955-06-04,2cc8ed07-3c06-47d4-b26a-64ab1f5df6eb | Polska Akademia Nauk | 1955-06-04,Działająca | 1955-06-04,instytut naukowy PAN | 1955-06-04,Instytut Fizyki Jądrowej im. Henryka Niewodniczańskiego Polskiej Akademii Nauk | 1955-06-04
1655155c-28da-45e1-ac0f-77c46dde131e,Instytut Fizyki Molekularnej Polskiej Akademii Nauk,REPORTS_INSTITUTION,Polska,000557990,167,0,1655155c-28da-45e1-ac0f-77c46dde131e,,Zbigniew,,7770020870,http://www.ifmpan.poznan.pl,,60-179,,61 8695 100,,POLON,Działająca,1,Poznań,instytut naukowy PAN,ul. Mariana Smoluchowskiego,wielkopolskie,1759842905871,,bi95ii9AQejdp_lpyj6STtw,2,,15,Polska | wielkopolskie | Poznań | 60-179 | ul. Mariana Smoluchowskiego |  |  | 1975-02-25,2cc8ed07-3c06-47d4-b26a-64ab1f5df6eb | Polska Akademia Nauk | 1975-02-25,Działająca | 1975-02-25,instytut naukowy PAN | 1975-02-25,Instytut Fizyki Molekularnej Polskiej Akademii Nauk | 1975-02-25
af3897e6-5183-462d-8b0b-b6a6469b5fda,Instytut Fizyki Plazmy i Laserowej Mikrosyntezy,REPORTS_INSTITUTION,Polska,010371929,167,0,af3897e6-5183-462d-8b0b-b6a6469b5fda,,Monika,,5250007193,http://www.ifpilm.pl,,01-497,,+22 6381460,,POLON,Działająca,1,Warszawa,instytut badawczy,ul. Hery,mazowieckie,1750836916502,0000202697,bgbtDmT2xNGaLxKwwFKbBUA,1,,7,Polska | mazowieckie | Warszawa | 01-497 | ul. Hery |  |  | 1976-01-01,b19d0545-dcf0-4f9c-8414-9328e1831c24 | Minister Gospodarki | 1976-01-01 ; 5bd5c28a-b763-43c7-86b0-79a4cc745664 | Minister Energii | 2016-08-31 ; 39d86820-f093-46f4-a6bf-facd6137b25a | Minister Klimatu i Środowiska (poprzednio MŚiK) | 2021-04-12 ; f9e9ba22-a913-44c1-9453-db011acff8e8 | Minister Przemysłu | 2024-08-06,Działająca | 1976-01-01,instytut badawczy | 1976-01-01,Instytut Fizyki Plazmy i Laserowej Mikrosyntezy | 1976-01-01
bcec464c-f81e-4ff1-b0f0-2c9581715fe5,Instytut Fizyki Polskiej Akademii Nauk,REPORTS_INSTITUTION,Polska,000326061,167,0,bcec464c-f81e-4ff1-b0f0-2c9581715fe5,,Leszek,,5250009275,http://www.ifpan.edu.pl,,02-668,,22 843 70 01,,POLON,Działająca,1,Warszawa,instytut naukowy PAN,Aleja Lotników,mazowieckie,1761671705501,,btSYdQGYDtmYBdiC2rKR_nQ,2,,7,Polska | mazowieckie | Warszawa | 02-668 | Aleja Lotników |  |  | 1953-09-24,2cc8ed07-3c06-47d4-b26a-64ab1f5df6eb | Polska Akademia Nauk | 1953-09-24,Działająca | 1953-09-24,instytut naukowy PAN | 1953-09-24,Instytut Fizyki Polskiej Akademii Nauk | 1953-09-24
e37107d0-a2ea-47b0-abe0-847a23a43089,Instytut Genetyki Człowieka Polskiej Akademii Nauk,REPORTS_INSTITUTION,Polska,000326428,167,0,e37107d0-a2ea-47b0-abe0-847a23a43089,,Maciej,,7811745737,http://www.igcz.poznan.pl,,60-479,,+48 61 6579100,,POLON,Działająca,1,Poznań,instytut naukowy PAN,ul. Strzeszyńska,wielkopolskie,1750836894824,,bFhJlSgNLVQOBOA0xxvzVfg,2,,15,Polska | wielkopolskie | Poznań | 60-479 | ul. Strzeszyńska |  |  | 2003-04-01,2cc8ed07-3c06-47d4-b26a-64ab1f5df6eb | Polska Akademia Nauk | 2003-04-01,Działająca | 2003-04-01,instytut naukowy PAN | 2003-04-01,Instytut Genetyki Człowieka Polskiej Akademii Nauk | 2003-04-01
c808eebe-2cda-46c5-bb49-3cbc713eaa75,Instytut Genetyki i Biotechnologii Zwierząt Polskiej Akademii Nauk,REPORTS_INSTITUTION,Polska,000326196,167,0,c808eebe-2cda-46c5-bb49-3cbc713eaa75,,Agnieszka,,1230018381,http://www.igbzpan.pl,,05-552,,22 756 17 11,,POLON,Działająca,1,Garbatka,instytut naukowy PAN,ul. Postępu,mazowieckie,1774515412571,,b1f8yFvsXVe0iKjEnSD0moQ,2,,7,Polska | mazowieckie | Garbatka | 05-552 | ul. Postępu |  |  | 1955-01-01,2cc8ed07-3c06-47d4-b26a-64ab1f5df6eb | Polska Akademia Nauk | 1955-01-01,Działająca | 1955-01-01,instytut naukowy PAN | 1955-01-01,Instytut Genetyki i Hodowli Zwierząt Polskiej Akademii Nauk | 1955-01-01 ; Instytut Genetyki i Biotechnologii Zwierząt Polskiej Akademii Nauk | 2020-04-21
8c23d792-e600-4050-baa6-bc6f06bfe269,Instytut Genetyki Roślin Polskiej Akademii Nauk,REPORTS_INSTITUTION,Polska,000326204,167,0,8c23d792-e600-4050-baa6-bc6f06bfe269,,Paweł,,7811621455,http://www.igr.poznan.pl,,60-479,,616550200,,POLON,Działająca,1,Poznań,instytut naukowy PAN,ul. Strzeszyńska,wielkopolskie,1750836894769,,bfK7X6aQfJV34uiKY4gFvAA,2,,15,Polska | wielkopolskie | Poznań | 60-479 | ul. Strzeszyńska |  |  | 1954-12-21,2cc8ed07-3c06-47d4-b26a-64ab1f5df6eb | Polska Akademia Nauk | 1954-12-21,Działająca | 1954-12-21,instytut naukowy PAN | 1954-12-21,Instytut Genetyki Roślin Polskiej Akademii Nauk | 1954-12-21
542de6bc-375c-4170-a162-428803c53c16,Instytut Geodezji i Kartografii,REPORTS_INSTITUTION,Polska,000332305,167,0,542de6bc-375c-4170-a162-428803c53c16,,Michał,,5250009476,http://www.igik.edu.pl,,02-679,,(22) 3291-900,,POLON,Działająca,1,Warszawa,instytut badawczy,ul. Zygmunta Modzelewskiego,mazowieckie,1750836896979,,bl7IPIHE8vXSaZNrXs7VQHQ,1,,7,Polska | mazowieckie | Warszawa | 02-679 | ul. Zygmunta Modzelewskiego |  |  | 1945-03-30 ; Polska | mazowieckie | Warszawa | 02-679 | ul. Zygmunta Modzelewskiego |  |  | 2021-10-05,04fb00a8-4327-4852-af74-6ec3060573d2 | Minister Cyfryzacji | 1945-03-30 ; 311faa11-6721-4dcd-a93c-a1a4492c755e | Minister Infrastruktury (poprzednio MiB) | 2016-01-14 ; ea92a74d-9594-48bf-9e03-4de781cff5b8 | Minister Rozwoju i Technologii (poprzednio MRPiT) | 2021-10-05,Działająca | 1945-03-30,instytut badawczy | 1945-03-30,Instytut Geodezji i Kartografii | 1945-03-30
511f81bf-1097-4e3d-905f-7df8bf7a67c5,Instytut Geofizyki Polskiej Akademii Nauk,REPORTS_INSTITUTION,Polska,000325908,167,0,511f81bf-1097-4e3d-905f-7df8bf7a67c5,,Paweł,,5250008560,http://www.igf.edu.pl,,01-452,,022 69-15-950,,POLON,Działająca,1,Warszawa,instytut naukowy PAN,ul. Księcia Janusza,mazowieckie,1768392905926,,brxjSi7UqeOCMt2Da6QQ-GA,2,,7,Polska | mazowieckie | Warszawa | 01-452 | ul. Księcia Janusza |  |  | 1952-01-01,2cc8ed07-3c06-47d4-b26a-64ab1f5df6eb | Polska Akademia Nauk | 1952-01-01,Działająca | 1952-01-01,instytut naukowy PAN | 1952-01-01,Instytut Geofizyki Polskiej Akademii Nauk | 1952-01-01
7688bf94-399f-4567-854e-220f826816fb,Instytut Geografii i Przestrzennego Zagospodarowania im. Stanisława Leszczyckiego Polskiej Akademii Nauk,REPORTS_INSTITUTION,Polska,000325854,167,0,7688bf94-399f-4567-854e-220f826816fb,,Tomasz,,5250012188,http://www.igipz.pan.pl,,00-818,,48 22 69-78-841,,POLON,Działająca,1,Warszawa,instytut naukowy PAN,ul. Twarda,mazowieckie,1773735306312,,bIVuXx-j3MA3vg5GttGgoow,2,,7,Polska | mazowieckie | Warszawa | 00-818 | ul. Twarda |  |  | 1953-10-10,2cc8ed07-3c06-47d4-b26a-64ab1f5df6eb | Polska Akademia Nauk | 1953-10-10,Działająca | 1953-10-10,instytut naukowy PAN | 1953-10-10,Instytut Geografii i Przestrzennego Zagospodarowania im. Stanisława Leszczyckiego Polskiej Akademii Nauk | 1953-10-10
e1a3797c-fdcd-4c06-9086-62f135288925,Instytut Gospodarki Przestrzennej i Mieszkalnictwa,REPORTS_INSTITUTION,Polska,015279884,167,0,e1a3797c-fdcd-4c06-9086-62f135288925,,,,5262662733,http:\\www.igpim.pl,,03-728,,22 6191350,,POLON,Przekształcona,4,Warszawa,instytut badawczy,ul. Targowa,mazowieckie,1750836894901,,bttYt_xIIRZlXJBQoNv-naQ,1,,7,Polska | mazowieckie | Warszawa | 03-728 | ul. Targowa |  |  | 2002-11-01,"71a66710-c6dd-4862-b0dc-e53c27ca8e5f | Minister Transportu, Budownictwa i Gospodarki Morskiej | 2002-11-01 ; 83952504-3c9d-4c32-ac88-181377c50554 | Minister Infrastruktury i Rozwoju | 2013-11-27 ; 311faa11-6721-4dcd-a93c-a1a4492c755e | Minister Infrastruktury (poprzednio MiB) | 2016-01-14",Działająca | 2002-11-01 ; Przekształcona | 2018-01-01,instytut badawczy | 2002-11-01,Instytut Gospodarki Przestrzennej i Mieszkalnictwa | 2002-11-01
3178cdc9-4bfd-44e5-a0dc-d37b30326a58,Instytut Gospodarki Surowcami Mineralnymi i Energią Polskiej Akademii Nauk,REPORTS_INSTITUTION,Polska,001238650,167,0,3178cdc9-4bfd-44e5-a0dc-d37b30326a58,,Magdalena,,6750001900,http://www.min-pan.krakow.pl,,31-261,,(+48)126323300,,POLON,Działająca,1,Kraków,instytut naukowy PAN,ul. Józefa Wybickiego,małopolskie,1750836894927,,bnin_CfrOxQK6XxaYJytRhg,2,,6,Polska | małopolskie | Kraków | 31-261 | ul. Józefa Wybickiego |  |  | 1986-01-01,2cc8ed07-3c06-47d4-b26a-64ab1f5df6eb | Polska Akademia Nauk | 1986-01-01,Działająca | 1986-01-01,instytut naukowy PAN | 1986-01-01,Instytut Gospodarki Surowcami Mineralnymi i Energią Polskiej Akademii Nauk | 1986-01-01
e711ee8e-d6f5-4f65-bd9b-29d4fe201466,Instytut Gruźlicy i Chorób Płuc,REPORTS_INSTITUTION,Polska,000288490,167,0,e711ee8e-d6f5-4f65-bd9b-29d4fe201466,,Ewa,,5250008838,http://www.igichp.edu.pl,,01-138,,22 43 12 428,,POLON,Działająca,1,Warszawa,instytut badawczy,ul. Płocka,mazowieckie,1750836897038,0000141482,btz9n5ZEfjQ8kaVG7tKm2Hw,1,,7,Polska | mazowieckie | Warszawa | 01-138 | ul. Płocka |  |  | 1951-03-10,2b2e64d0-dc32-4575-ba6c-073f0757f4f9 | Minister Nauki i Szkolnictwa Wyższego (poprzednio MEiN) | 1951-03-10 ; e32dba3a-b2a3-41da-8019-314f1091d013 | Minister Zdrowia | 2012-09-18,Działająca | 1951-03-10,instytut badawczy | 1951-03-10,Instytut Gruźlicy i Chorób Płuc | 1951-03-10
61b49d12-2b15-473d-98e8-d4d874973bcd,Instytut Hematologii i Transfuzjologii,REPORTS_INSTITUTION,Polska,000288484,167,0,61b49d12-2b15-473d-98e8-d4d874973bcd,,Ewa,,5250009424,http://www.ihit.waw.pl,,02-776,,22 3496100,,POLON,Działająca,1,Warszawa,instytut badawczy,ul. Indiry Gandhi,mazowieckie,1750836894697,,bnG-e53W_Hi4NXdss6g991Q,1,,7,Polska | mazowieckie | Warszawa | 02-776 | ul. Indiry Gandhi |  |  | 1951-06-02,2b2e64d0-dc32-4575-ba6c-073f0757f4f9 | Minister Nauki i Szkolnictwa Wyższego (poprzednio MEiN) | 1951-06-02 ; e32dba3a-b2a3-41da-8019-314f1091d013 | Minister Zdrowia | 2012-09-18,Działająca | 1951-06-02,instytut badawczy | 1951-06-02,Instytut Hematologii i Transfuzjologii | 1951-06-02
0160a6a0-6886-44b8-bbf8-4296df6c35ec,Instytut Historii im. Tadeusza Manteuffla Polskiej Akademii Nauk,REPORTS_INSTITUTION,Polska,000325765,167,0,0160a6a0-6886-44b8-bbf8-4296df6c35ec,,Maciej,,5250009134,http://www.ihpan.edu.pl,,00-272,,22 831 36 42,,POLON,Działająca,1,Warszawa,instytut naukowy PAN,Rynek Starego Miasta,mazowieckie,1750836895094,,bsFXqcMUEmm0C4RhCx2RNvg,2,,7,Polska | mazowieckie | Warszawa | 00-272 | Rynek Starego Miasta |  |  | 1953-01-01 ; Polska | mazowieckie | Warszawa | 00-272 | Rynek Starego Miasta |  |  | 2023-12-22,2cc8ed07-3c06-47d4-b26a-64ab1f5df6eb | Polska Akademia Nauk | 1953-01-01,Działająca | 1953-01-01,instytut naukowy PAN | 1953-01-01,Instytut Historii im. Tadeusza Manteuffla Polskiej Akademii Nauk | 1953-01-01
c1344d9d-7e2f-4a2f-af85-3bc12dae9929,Instytut Historii Nauki imienia Ludwika i Aleksandra Birkenmajerów Polskiej Akademii Nauk,REPORTS_INSTITUTION,Polska,000326411,167,0,c1344d9d-7e2f-4a2f-af85-3bc12dae9929,,Jacek,,5250008784,http://ihnpan.pl,,00-330,,226572746,,POLON,Działająca,1,Warszawa,instytut naukowy PAN,ul. Nowy Świat,mazowieckie,1750836896957,,bc01s9n-DqbcqpJT_3ogTpA,2,,7,Polska | mazowieckie | Warszawa | 00-330 | ul. Nowy Świat |  |  | 1977-06-16,2b2e64d0-dc32-4575-ba6c-073f0757f4f9 | Minister Nauki i Szkolnictwa Wyższego (poprzednio MEiN) | 1977-06-16 ; 2cc8ed07-3c06-47d4-b26a-64ab1f5df6eb | Polska Akademia Nauk | 2012-10-11,Działająca | 1977-06-16,instytut naukowy PAN | 1977-06-16,Instytut Historii Nauki imienia Ludwika i Aleksandra Birkenmajerów Polskiej Akademii Nauk | 1977-06-16
b464c7a7-69dc-45c8-8163-705096a92b18,Instytut Hodowli i Aklimatyzacji Roślin - Państwowy Instytut Badawczy,REPORTS_INSTITUTION,Polska,000079480,167,1,b464c7a7-69dc-45c8-8163-705096a92b18,,Sławomir,,5290007029,http://www.ihar.edu.pl,,05-870,,22 7334500,,POLON,Działająca,1,Radzików,instytut badawczy,,mazowieckie,1759842905871,0000074008,bmfkTgrYux51kKuOA70Q27Q,1,,7,Polska | mazowieckie | Radzików | 05-870 |  |  |  | 1951-01-01,2b2e64d0-dc32-4575-ba6c-073f0757f4f9 | Minister Nauki i Szkolnictwa Wyższego (poprzednio MEiN) | 1951-01-01 ; b8ccc265-859a-4ca1-9579-60150e8908a4 | Minister Rolnictwa i Rozwoju Wsi | 2012-10-04,Działająca | 1951-01-01,instytut badawczy | 1951-01-01,Instytut Hodowli i Aklimatyzacji Roślin - Państwowy Instytut Badawczy | 1951-01-01
264294d6-d6d7-4b7e-93b6-8f267f0a455e,Instytut Immunologii i Terapii Doświadczalnej im. Ludwika Hirszfelda Polskiej Akademii Nauk,REPORTS_INSTITUTION,Polska,000325883,167,0,264294d6-d6d7-4b7e-93b6-8f267f0a455e,,Andrzej,,8960005696,https://hirszfeld.pl/,,53-114,,"71 3709905; ",,POLON,Działająca,1,Wrocław,instytut naukowy PAN,ul. Rudolfa Weigla,dolnośląskie,1750836894952,,byot1zGR6DaDBaUruYE9Eyg,2,,1,Polska | dolnośląskie | Wrocław | 53-114 | ul. Rudolfa Weigla |  |  | 1952-12-02,2cc8ed07-3c06-47d4-b26a-64ab1f5df6eb | Polska Akademia Nauk | 1952-12-02,Działająca | 1952-12-02,instytut naukowy PAN | 1952-12-02,Instytut Immunologii i Terapii Doświadczalnej im. Ludwika Hirszfelda Polskiej Akademii Nauk | 1952-12-02
456ee281-d8ed-49d6-9be7-4dab317610fb,Instytut Informatyki Teoretycznej i Stosowanej Polskiej Akademii Nauk,REPORTS_INSTITUTION,Polska,000564702,167,0,456ee281-d8ed-49d6-9be7-4dab317610fb,,Krzysztof,,6310112245,http://www.iitis.pl,,44-100,,+48322317319,,POLON,Działająca,1,Gliwice,instytut naukowy PAN,ul. Bałtycka,śląskie,1750836897166,,bwMFmWfr8KJtwNRmMdBB2Zg,2,,12,Polska | śląskie | Gliwice | 44-100 | ul. Bałtycka |  |  | 1989-01-17,2cc8ed07-3c06-47d4-b26a-64ab1f5df6eb | Polska Akademia Nauk | 1989-01-17,Działająca | 1989-01-17,instytut naukowy PAN | 1989-01-17,Instytut Informatyki Teoretycznej i Stosowanej Polskiej Akademii Nauk | 1989-01-17
c1e509a2-9a9f-4bba-9ab3-4c9c463efa18,Instytut Inżynierii Chemicznej Polskiej Akademii Nauk,REPORTS_INSTITUTION,Polska,000564694,167,0,c1e509a2-9a9f-4bba-9ab3-4c9c463efa18,,Marek,,6310112239,http://www.iich.gliwice.pl,,44-100,,322310811,,POLON,Działająca,1,Gliwice,instytut naukowy PAN,ul. Bałtycka,śląskie,1750836896863,,brDIv_yADzjmxhA02sXUtZQ,2,,12,Polska | śląskie | Gliwice | 44-100 | ul. Bałtycka |  |  | 1958-10-14,2cc8ed07-3c06-47d4-b26a-64ab1f5df6eb | Polska Akademia Nauk | 1958-10-14,Działająca | 1958-10-14,instytut naukowy PAN | 1958-10-14,Instytut Inżynierii Chemicznej Polskiej Akademii Nauk | 1958-10-14
5c3e8361-f5f3-4fc9-8751-5b1cb44e67a2,Instytut Języka Polskiego Polskiej Akademii Nauk,REPORTS_INSTITUTION,Polska,357534720,167,0,5c3e8361-f5f3-4fc9-8751-5b1cb44e67a2,,Michał,,6750001892,http://ijppan.pl,,31-120,,126325692,,POLON,Działająca,1,Kraków,instytut naukowy PAN,al. Adama Mickiewicza,małopolskie,1750836916288,,bzJUYFuMRws2WslBhdN4wcg,2,,6,Polska | małopolskie | Kraków | 31-120 | al. Adama Mickiewicza |  |  | 1973-10-01,2cc8ed07-3c06-47d4-b26a-64ab1f5df6eb | Polska Akademia Nauk | 1973-10-01,Działająca | 1973-10-01,instytut naukowy PAN | 1973-10-01,Instytut Języka Polskiego Polskiej Akademii Nauk | 1973-10-01
bbdc19a0-7611-48bc-85b5-5072e791573a,Instytut Katalizy i Fizykochemii Powierzchni im. Jerzego Habera Polskiej Akademii Nauk,REPORTS_INSTITUTION,Polska,000326351,167,0,bbdc19a0-7611-48bc-85b5-5072e791573a,,Piotr,,6750001805,https://ikifp.edu.pl/,,30-239,,12 6395101,,POLON,Działająca,1,Kraków,instytut naukowy PAN,ul. Niezapominajek,małopolskie,1750836895125,,bUTj-4n-6geiAzfKPaPBNhg,2,,6,Polska | małopolskie | Kraków | 30-239 | ul. Niezapominajek |  |  | 1968-01-01,2cc8ed07-3c06-47d4-b26a-64ab1f5df6eb | Polska Akademia Nauk | 1968-01-01,Działająca | 1968-01-01,instytut naukowy PAN | 1968-01-01,Instytut Katalizy i Fizykochemii  Powierzchni w Krakowie | 1968-01-01 ; Instytut Katalizy i Fizykochemii Powierzchni im. Jerzego Habera Polskiej Akademii Nauk | 2011-01-01
18314b31-a926-409d-ba21-47bfbf345cf4,Instytut Kolejnictwa,REPORTS_INSTITUTION,Polska,016382785,167,0,18314b31-a926-409d-ba21-47bfbf345cf4,,Andrzej,,1132257883,http://www.ikolej.pl,,04-275,,22 47  31 300,,POLON,Działająca,1,Warszawa,instytut badawczy,ul. Józefa Chłopickiego,mazowieckie,1750836894993,,bLhM3jhuAKohEHEDKBpAo9Q,1,,7,Polska | mazowieckie | Warszawa | 04-275 | ul. Józefa Chłopickiego |  |  | 1951-07-05,"71a66710-c6dd-4862-b0dc-e53c27ca8e5f | Minister Transportu, Budownictwa i Gospodarki Morskiej | 1951-07-05 ; 83952504-3c9d-4c32-ac88-181377c50554 | Minister Infrastruktury i Rozwoju | 2013-11-27 ; 311faa11-6721-4dcd-a93c-a1a4492c755e | Minister Infrastruktury (poprzednio MiB) | 2016-01-14",Działająca | 1951-07-05,instytut badawczy | 1951-07-05,Instytut Kolejnictwa | 1951-07-05
5f51bb88-7b30-42e9-a297-c7702a42ef1a,Instytut Kultur Śródziemnomorskich i Orientalnych Polskiej Akademii Nauk,REPORTS_INSTITUTION,Polska,142519634,167,0,5f51bb88-7b30-42e9-a297-c7702a42ef1a,,Jadwiga,,5252485577,http://www.iksiopan.pl/,,00-330,,22-6572791,,POLON,Działająca,1,Warszawa,instytut naukowy PAN,ul. Nowy Świat,mazowieckie,1750836895103,,bZSETxVBptXf-UXwLkaWDrg,2,,7,Polska | mazowieckie | Warszawa | 00-330 | ul. Nowy Świat |  |  | 2010-09-01,2cc8ed07-3c06-47d4-b26a-64ab1f5df6eb | Polska Akademia Nauk | 2010-09-01,Działająca | 2010-09-01,instytut naukowy PAN | 2010-09-01,Instytut Kultur Śródziemnomorskich i Orientalnych Polskiej Akademii Nauk | 2010-09-01
089b2e0c-a210-4c2c-a228-5184f7b2a5a0,Instytut Leków w Warszawie,REPORTS_INSTITUTION,Polska,,167,0,089b2e0c-a210-4c2c-a228-5184f7b2a5a0,,,,,,,01-000,,,,POLON,Przekształcona,4,Warszawa,instytut badawczy,ul. Chełmska,mazowieckie,1750836897037,,b_1qKgXDo7y-pZDzuOp2hzQ,1,,7,Polska | mazowieckie | Warszawa | 01-000 | ul. Chełmska |  |  | 1900-01-01,e32dba3a-b2a3-41da-8019-314f1091d013 | Minister Zdrowia | 1900-01-01,Działająca | 1900-01-01 ; Przekształcona | 2006-12-08,instytut badawczy | 1900-01-01,Instytut Leków w Warszawie | 1900-01-01
d86ce494-55e8-4d01-929c-48a2908e6e5a,Instytut Łączności - Państwowy Instytut Badawczy,REPORTS_INSTITUTION,Polska,000132629,167,1,d86ce494-55e8-4d01-929c-48a2908e6e5a,,Anna,,5250009312,https://www.gov.pl/web/instytut-lacznosci,,04-894,,+48 22 51 28 100,,POLON,Działająca,1,Warszawa,instytut badawczy,ul. Szachowa,mazowieckie,1750836897141,0000023097,bdoAFCGTorZ9N_5NoE6bisA,1,,7,Polska | mazowieckie | Warszawa | 04-894 | ul. Szachowa |  |  | 1951-09-18,04fb00a8-4327-4852-af74-6ec3060573d2 | Minister Cyfryzacji | 1951-09-18,Działająca | 1951-09-18,instytut badawczy | 1951-09-18,Instytut Łączności - Państwowy Instytut Badawczy | 1951-09-18
57f4b544-5c0b-4509-b22c-e05271aab47a,Instytut Maszyn Matematycznych,REPORTS_INSTITUTION,Polska,000035197,167,0,57f4b544-5c0b-4509-b22c-e05271aab47a,,,,5250008962,http://www.imm.org.pl,,02-078,,22-621-84-41,,POLON,Przekształcona,4,Warszawa,instytut badawczy,ul. Ludwika Krzywickiego,mazowieckie,1750836896908,,blCXYMwUzpwNdUX__qh2vnA,1,,7,Polska | mazowieckie | Warszawa | 02-078 | ul. Ludwika Krzywickiego |  |  | 1962-04-27,b19d0545-dcf0-4f9c-8414-9328e1831c24 | Minister Gospodarki | 1962-04-27 ; 04fb00a8-4327-4852-af74-6ec3060573d2 | Minister Cyfryzacji | 2016-01-13,Działająca | 1962-04-27 ; Przekształcona | 2018-02-01,instytut badawczy | 1962-04-27,Instytut Maszyn Matematycznych | 1962-04-27
674b7e57-dd24-4e8d-8949-327fa2f8bc82,Instytut Maszyn Przepływowych im. Roberta Szewalskiego Polskiej Akademii Nauk,REPORTS_INSTITUTION,Polska,000326121,167,0,674b7e57-dd24-4e8d-8949-327fa2f8bc82,,Marcin,,5840357882,http://www.imp.gda.pl,,80-231,,(58) 3411 271,,POLON,Działająca,1,Gdańsk,instytut naukowy PAN,ul. gen. Józefa Fiszera,pomorskie,1750836896994,,b3JwWgz_uDIpMZyMFk3QpAw,2,,11,Polska | pomorskie | Gdańsk | 80-231 | ul. gen. Józefa Fiszera |  |  | 1956-07-02,2cc8ed07-3c06-47d4-b26a-64ab1f5df6eb | Polska Akademia Nauk | 1956-07-02,Działająca | 1956-07-02,instytut naukowy PAN | 1956-07-02,Instytut Maszyn Przepływowych im. Roberta Szewalskiego Polskiej Akademii Nauk | 1956-07-02
96a58ef3-d4b3-4384-b9e4-4792d490536f,Instytut Matematyczny Polskiej Akademii Nauk,REPORTS_INSTITUTION,Polska,000325860,167,0,96a58ef3-d4b3-4384-b9e4-4792d490536f,,Karol,,5250008867,http://www.impan.pl/,,00-656,,22 5228100,,POLON,Działająca,1,Warszawa,instytut naukowy PAN,ul. Jana i Jędrzeja Śniadeckich,mazowieckie,1750836897173,,bdcud9f5wTDoe2In0PutAaw,2,,7,Polska | mazowieckie | Warszawa | 00-656 | ul. Jana i Jędrzeja Śniadeckich |  |  | 1948-11-20,2cc8ed07-3c06-47d4-b26a-64ab1f5df6eb | Polska Akademia Nauk | 1948-11-20,Działająca | 1948-11-20,instytut naukowy PAN | 1948-11-20,Instytut Matematyczny Polskiej Akademii Nauk | 1948-11-20
1d973f03-c5b4-4907-8157-05b91969c700,Instytut Matki i Dziecka,REPORTS_INSTITUTION,Polska,000288395,167,0,1d973f03-c5b4-4907-8157-05b91969c700,,Alicja,,5250008471,http://www.imid.med.pl,,01-211,,"22, 3277305, 332",,POLON,Działająca,1,Warszawa,instytut badawczy,ul. Marcina Kasprzaka,mazowieckie,1761905930515,,blqG9vV9Ni78LQIAWFAXahQ,1,,7,Polska | mazowieckie | Warszawa | 01-211 | ul. Marcina Kasprzaka |  |  | 1951-03-10,e32dba3a-b2a3-41da-8019-314f1091d013 | Minister Zdrowia | 1951-03-10,Działająca | 1951-03-10,instytut badawczy | 1951-03-10,Instytut Matki i Dziecka | 1951-03-10
2e1e6c2d-6b50-4115-9e97-a2cee488f353,Instytut Mechaniki Górotworu Polskiej Akademii Nauk,REPORTS_INSTITUTION,Polska,000326368,167,0,2e1e6c2d-6b50-4115-9e97-a2cee488f353,,Przemysław,,6750001840,http://www.imgpan.pl,,30-059,,126376200,,POLON,Działająca,1,Kraków,instytut naukowy PAN,ul. Władysława Stanisława Reymonta,małopolskie,1773594905342,,bj27tL_rvHoo5VZAgM5eZ_g,2,,6,Polska | małopolskie | Kraków | 30-059 | ul. Władysława Stanisława Reymonta |  |  | 1954-09-11,2cc8ed07-3c06-47d4-b26a-64ab1f5df6eb | Polska Akademia Nauk | 1954-09-11,Działająca | 1954-09-11,instytut naukowy PAN | 1954-09-11,Instytut Mechaniki Górotworu Polskiej Akademii Nauk | 1954-09-11
8233db0e-f39a-47a6-a03c-5004abc36afc,Instytut Medycyny Doświadczalnej i Klinicznej im. Mirosława Mossakowskiego Polskiej Akademii Nauk,REPORTS_INSTITUTION,Polska,000326463,167,0,8233db0e-f39a-47a6-a03c-5004abc36afc,,Leonora,,5250008169,http://www.imdik.pan.pl,,02-106,,48226086493,,POLON,Działająca,1,Warszawa,instytut naukowy PAN,ul. Adolfa Pawińskiego,mazowieckie,1766152290035,,byA-JkHm2bCn9kbaIrhLEug,2,,7,Polska | mazowieckie | Warszawa | 02-106 | ul. Adolfa Pawińskiego |  |  | 1967-07-01,2cc8ed07-3c06-47d4-b26a-64ab1f5df6eb | Polska Akademia Nauk | 1967-07-01,Działająca | 1967-07-01,instytut naukowy PAN | 1967-07-01,Instytut Medycyny Doświadczalnej i Klinicznej im. Mirosława Mossakowskiego Polskiej Akademii Nauk | 1967-07-01
