id,name,objectType,country,regon,countryCd,pib,institutionUuid,lNumber,managerName,eMail,nip,www,iKindName,postalCd,bNumber,phone,iStartDT,dataSource,status,statusCode,city,siTypeName,street,voivodeship,lastRefresh,krs,institutionUid,siTypeCd,uTypeCd,voivodeshipCode,addresses,supervisingInstitutions,statuses,types,names
1c749f42-2a28-46f6-a59f-63d4e8541713,Pomorski Uniwersytet Medyczny w Szczecinie,REPORTS_INSTITUTION,Polska,000288886,167,0,1c749f42-2a28-46f6-a59f-63d4e8541713,,Leszek,,8520006757,http://www.pum.edu.pl,,70-204,,914800801,,POLON,Działająca,1,Szczecin,,ul. Rybacka,zachodniopomorskie,1774852204943,,bGdC_bzKT-HVRZ9O1mobrEA,,,16,Polska | zachodniopomorskie | Szczecin | 70-204 | ul. Rybacka |  |  | 1948-03-20,e32dba3a-b2a3-41da-8019-314f1091d013 | Minister Zdrowia | 1948-03-20,Działająca | 1948-03-20,akademicka | 1948-03-20,Pomorski Uniwersytet Medyczny w Szczecinie | 1948-03-20
bc3eae7b-1b6a-4a7c-8db2-5ef5f8a94051,Powiślańska Akademia Nauk Stosowanych,REPORTS_INSTITUTION,Polska,191871175,167,0,bc3eae7b-1b6a-4a7c-8db2-5ef5f8a94051,,Katarzyna,,5811722066,http://powislanska.edu.pl,,82-500,,"55 615 13 71  ",,POLON,Działająca,1,Kwidzyn,,ul. 11 Listopada,pomorskie,1759842906242,,bLQHMKhHKjKKV1mhKJVMV3g,,,11,Polska | pomorskie | Kwidzyn | 82-500 | ul. 11 Listopada |  |  | 1999-09-22,2b2e64d0-dc32-4575-ba6c-073f0757f4f9 | Minister Nauki i Szkolnictwa Wyższego (poprzednio MEiN) | 1999-09-22,Działająca | 1999-09-22,zawodowa | 1999-09-22,Powiślańska Szkoła Wyższa w Kwidzynie | 1999-09-22 ; Powiślańska Akademia Nauk Stosowanych | 2025-10-01 ; Powiślańska Szkoła Wyższa | 2008-04-11
c8d725eb-bb10-4712-84a2-35c4785a15ae,"Powszechna Wyższa Szkoła Humanistyczna ""Pomerania"" w Chojnicach",REPORTS_INSTITUTION,Polska,193059070,167,0,c8d725eb-bb10-4712-84a2-35c4785a15ae,,Magdalena,,5551930312,http://www.pomeraniachojnice.edu.pl,,89-620,,(52)3342887,,POLON,Działająca,1,Chojnice,,ul. Świętopełka,pomorskie,1750836897139,,b1OfcMt0wkas7SCGu6MfsEQ,,,11,Polska | pomorskie | Chojnice | 89-620 | ul. Świętopełka |  |  | 2004-06-19,2b2e64d0-dc32-4575-ba6c-073f0757f4f9 | Minister Nauki i Szkolnictwa Wyższego (poprzednio MEiN) | 2004-06-19,Działająca | 2004-06-19,zawodowa | 2004-06-19,"Powszechna Wyższa Szkoła Humanistyczna ""Pomerania"" w Chojnicach | 2004-06-19"
6a71f2f0-1f33-4abf-8731-a9a4d1157af7,Poznańska Akademia Medyczna Nauk Stosowanych im. Księcia Mieszka I,REPORTS_INSTITUTION,Polska,300410823,167,0,6a71f2f0-1f33-4abf-8731-a9a4d1157af7,,Włodzimierz,,7831595399,www.pam.poznan.pl,,60-320,,616-460-370,,POLON,Działająca,1,Poznań,,ul. Bułgarska,wielkopolskie,1750836895091,,bUNJiUXRaIdniERkmBq06zQ,,,15,Polska | wielkopolskie | Poznań | 60-320 | ul. Bułgarska |  |  | 2004-09-16,2b2e64d0-dc32-4575-ba6c-073f0757f4f9 | Minister Nauki i Szkolnictwa Wyższego (poprzednio MEiN) | 2004-09-16,Działająca | 2004-09-16,zawodowa | 2004-09-16,Wyższa Szkoła Pedagogiki i Administracji im. Mieszka I w Poznaniu | 2004-09-16 ; Poznańska Akademia Medyczna Nauk Stosowanych im. Księcia Mieszka I | 2024-02-01 ; Akademia Nauk Stosowanych im. Księcia Mieszka I w Poznaniu | 2022-03-01
c2efa02b-e573-4541-b8f0-2f588a84103b,Poznańskie Towarzystwo Przyjaciół Nauk,REPORTS_INSTITUTION,Polska,000806536,167,0,c2efa02b-e573-4541-b8f0-2f588a84103b,,Filip,,7780168479,http://ptpn.poznan.pl/,,61-725,,61 852 74 41,,POLON,Działająca,1,Poznań,inna instytucja naukowa,ul. Seweryna Mielżyńskiego,wielkopolskie,1750836897124,0000103951,,4,,15,Polska | wielkopolskie | Poznań | 61-725 | ul. Seweryna Mielżyńskiego |  |  | 1857-02-13,2b2e64d0-dc32-4575-ba6c-073f0757f4f9 | Minister Nauki i Szkolnictwa Wyższego (poprzednio MEiN) | 2022-04-29,Działająca | 1857-02-13,inna instytucja naukowa | 1857-02-13,Poznańskie Towarzystwo Przyjaciół Nauk | 1857-02-13
c2be6f11-8555-47b5-9806-575d4a661c27,Prawosławne Seminarium Duchowne w Warszawie,REPORTS_INSTITUTION,Polska,011574451,167,0,c2be6f11-8555-47b5-9806-575d4a661c27,,Jerzy,,1130304124,https://psd.edu.pl/,,03-945,,22 617 83 48,,POLON,Działająca,1,Warszawa,,ul. Paryska,mazowieckie,1750836895116,,bRTgUgYgyeci3PczWyDc0ww,,,7,Polska | mazowieckie | Warszawa | 03-945 | ul. Paryska |  |  | 1951-03-20,2b2e64d0-dc32-4575-ba6c-073f0757f4f9 | Minister Nauki i Szkolnictwa Wyższego (poprzednio MEiN) | 1951-03-20,Działająca | 1951-03-20,zawodowa | 1951-03-20,Prawosławne Seminarium Duchowne w Warszawie | 1951-03-20
7940e083-59f8-4a3a-bff5-0f95628ab244,Profesjonalna Szkoła Biznesu-Szkoła Wyższa w likwidacji w Krakowie,REPORTS_INSTITUTION,Polska,350724379,167,0,7940e083-59f8-4a3a-bff5-0f95628ab244,,,,6761005592,,,31-055,,,,POLON,Zlikwidowana,3,Kraków,,ul. Miodowa,małopolskie,1750836896817,,bGc5eF5hVRv9Rrbt0pRiRUQ,,,6,Polska | małopolskie | Kraków | 31-055 | ul. Miodowa |  |  | 1994-06-15,2b2e64d0-dc32-4575-ba6c-073f0757f4f9 | Minister Nauki i Szkolnictwa Wyższego (poprzednio MEiN) | 1994-06-15,Działająca | 1994-06-15 ; Zlikwidowana | 2014-12-10,zawodowa | 1994-06-15,Profesjonalna Szkoła Biznesu-Szkoła Wyższa w likwidacji w Krakowie | 1994-06-15
fdfbf74c-e955-4553-9e06-7622e5ca94d3,Prywatna Wyższa Szkoła Informatyki i Zarządzania im. Józefa Tyszkiewicza w Bielsku-Białej,REPORTS_INSTITUTION,Polska,,167,0,fdfbf74c-e955-4553-9e06-7622e5ca94d3,,,,,,,43-300,,,,POLON,Zlikwidowana,3,Bielsko-Biała,,ul. Nadbrzeżna,śląskie,1750836897070,,b-mgK-2oBDItJURWB-teBfg,,,12,Polska | śląskie | Bielsko-Biała | 43-300 | ul. Nadbrzeżna |  |  | 1992-06-24,2b2e64d0-dc32-4575-ba6c-073f0757f4f9 | Minister Nauki i Szkolnictwa Wyższego (poprzednio MEiN) | 1992-06-24,Działająca | 1992-06-24 ; Zlikwidowana | 1996-07-09,zawodowa | 1992-06-24,Prywatna Wyższa Szkoła Informatyki i Zarządzania im. Józefa Tyszkiewicza w Bielsku-Białej | 1992-06-24
15570eb2-05ce-4f28-81b9-ad0121b5df35,Prywatna Wyższa Szkoła Ochrony Środowiska w Radomiu,REPORTS_INSTITUTION,Polska,670679257,167,0,15570eb2-05ce-4f28-81b9-ad0121b5df35,,Ryszard,,7961189717,http://www.pwsos.pl,,26-600,,48 383 11 50,,POLON,Działająca,1,Radom,,ul. Marii Fołtyn,mazowieckie,1750836896909,,b7gHujbLTX5NcZC2fTHKvMw,,,7,Polska | mazowieckie | Radom | 26-600 | ul. Franciszka Zubrzyckiego |  |  | 1993-10-20 ; Polska | mazowieckie | Radom | 26-600 | ul. Marii Fołtyn |  |  | 2017-11-28,2b2e64d0-dc32-4575-ba6c-073f0757f4f9 | Minister Nauki i Szkolnictwa Wyższego (poprzednio MEiN) | 1993-10-20,Działająca | 1993-10-20,zawodowa | 1993-10-20,Prywatna Wyższa Szkoła Ochrony Środowiska w Radomiu | 1993-10-20
2a7324df-36f2-42a8-8637-d079ecc36d19,Przemysłowy Instytut Maszyn Budowlanych Sp. z o.o.,REPORTS_INSTITUTION,Polska,141384698,167,0,2a7324df-36f2-42a8-8637-d079ecc36d19,,,,1250000237,http://www.pimb.com.pl,,05-230,,227862326,,POLON,Wykreślona z wykazu,8,Kobyłka,inna instytucja naukowa,ul. Napoleona,mazowieckie,1750836895032,,bXp88cbwDrXQkU17jqzYugA,4,,7,Polska | mazowieckie | Kobyłka | 05-230 | ul. Napoleona |  |  | 1952-01-01,2b2e64d0-dc32-4575-ba6c-073f0757f4f9 | Minister Nauki i Szkolnictwa Wyższego (poprzednio MEiN) | 2022-04-29,Działająca | 1952-01-01 ; Wykreślona z wykazu | 2022-07-31,inna instytucja naukowa | 1952-01-01,Przemysłowy Instytut Maszyn Budowlanych Sp. z o.o. | 1952-01-01
53933f08-4e1d-450c-87dd-1397e0a4edd4,Publiczna Uczelnia Zawodowa w Grudziądzu,REPORTS_INSTITUTION,Polska,526881565,167,0,53933f08-4e1d-450c-87dd-1397e0a4edd4,,Michał,,8762507517,www.puzg.pl,,86-300,,576 060 123,,POLON,Działająca,1,Grudziądz,,ul. Kosynierów Gdyńskich,kujawsko-pomorskie,1775847387757,,,,,2,Polska | kujawsko-pomorskie | Grudziądz | 86-300 | ul. Kosynierów Gdyńskich |  |  | 2023-11-01,2b2e64d0-dc32-4575-ba6c-073f0757f4f9 | Minister Nauki i Szkolnictwa Wyższego (poprzednio MEiN) | 2023-11-01,Działająca | 2023-11-01,zawodowa | 2023-11-01,Publiczna Uczelnia Zawodowa w Grudziądzu | 2023-11-01
966036f2-1c5a-4a31-bb6c-0752c427a994,Puławska Szkoła Wyższa w likwidacji z siedzibą w Puławach,REPORTS_INSTITUTION,Polska,430847999,167,0,966036f2-1c5a-4a31-bb6c-0752c427a994,,,,7162084806,http://www.psw.pulawy.pl,,24-100,,+48818874949,,POLON,Zlikwidowana,3,Puławy,,ul. Stanisława Moniuszki,lubelskie,1750836896907,,bN2DsGQBRXldSKndo_dyh2w,,,3,Polska | lubelskie | Puławy | 24-100 | ul. Stanisława Moniuszki |  |  | 1997-07-23,2b2e64d0-dc32-4575-ba6c-073f0757f4f9 | Minister Nauki i Szkolnictwa Wyższego (poprzednio MEiN) | 1997-07-23,Działająca | 1997-07-23 ; Zlikwidowana | 2014-12-31,zawodowa | 1997-07-23,Puławska Szkoła Wyższa | 1997-07-23 ; Puławska Szkoła Wyższa w likwidacji z siedzibą w Puławach | 2014-06-12
103e7288-585f-468d-9fb9-567e0321d382,Radomska Szkoła Wyższa,REPORTS_INSTITUTION,Polska,670794107,167,0,103e7288-585f-468d-9fb9-567e0321d382,,Katarzyna,,7961100769,http://www.rsw.edu.pl,,26-600,,483836605,,POLON,Działająca,1,Radom,,ul. Franciszka Zubrzyckiego,mazowieckie,1753264023185,,bOg2Fz-GwG0qPGyweFV9E8A,,,7,Polska | mazowieckie | Radom | 26-600 | ul. Franciszka Zubrzyckiego |  |  | 1995-08-04,2b2e64d0-dc32-4575-ba6c-073f0757f4f9 | Minister Nauki i Szkolnictwa Wyższego (poprzednio MEiN) | 1995-08-04,Działająca | 1995-08-04,zawodowa | 1995-08-04,Radomska Szkoła Wyższa | 1995-08-04
c05d76c8-ff48-45f5-9489-ef55df4a8b67,"""READ-GENE"" SPÓŁKA AKCYJNA",REPORTS_INSTITUTION,Polska,320105636,167,0,c05d76c8-ff48-45f5-9489-ef55df4a8b67,,Jan,,8522464257,www.read-gene.com,,71-253,,(91)433-42-56,,POLON,Działająca,1,Szczecin,inna instytucja naukowa,ul. Akacjowa,zachodniopomorskie,1750836894883,,b9iMGHeQ8SmVoopTKLcDm1A,4,,16,Polska | zachodniopomorskie | Szczecin | 71-253 | ul. Akacjowa |  |  | 2005-09-27,2b2e64d0-dc32-4575-ba6c-073f0757f4f9 | Minister Nauki i Szkolnictwa Wyższego (poprzednio MEiN) | 2022-04-29,Działająca | 2005-09-27,inna instytucja naukowa | 2005-09-27,"""READ-GENE"" SPÓŁKA AKCYJNA | 2005-09-27"
8aac2c6a-b045-4ce4-a65f-cf679d0aeca9,Sano - Centrum Zindywidualizowanej Medycyny Obliczeniowej - Międzynarodowa Fundacja Badawcza,REPORTS_INSTITUTION,Polska,384298430,167,0,8aac2c6a-b045-4ce4-a65f-cf679d0aeca9,,Maciej,,6772446472,https://sano.science/,,30-054,,12 307 27 37,,POLON,Działająca,1,Kraków,inna instytucja naukowa,ul. Czarnowiejska,małopolskie,1762444275991,0000797490,,4,,6,Polska | małopolskie | Kraków | 30-072 | ul. Nawojki |  |  | 2019-09-05 ; Polska | małopolskie | Kraków | 30-054 | ul. Czarnowiejska |  |  | 2024-06-06,2b2e64d0-dc32-4575-ba6c-073f0757f4f9 | Minister Nauki i Szkolnictwa Wyższego (poprzednio MEiN) | 2019-09-05,Działająca | 2019-09-05,inna instytucja naukowa | 2019-09-05,Sano - Centrum Zindywidualizowanej Medycyny Obliczeniowej - Międzynarodowa Fundacja Badawcza | 2019-09-05
40f173f7-6025-4168-97d7-624a44334266,Schola Posnaniensis - Wyższa Szkoła Sztuki Stosowanej w Poznaniu,REPORTS_INSTITUTION,Polska,630214710,167,0,40f173f7-6025-4168-97d7-624a44334266,,,,,,,61-048,,,,POLON,Zlikwidowana,3,Poznań,,ul. Krańcowa,wielkopolskie,1750836894879,,bQuoidOhCiIEoq6UHTgph4g,,,15,Polska | wielkopolskie | Poznań | 61-048 | ul. Krańcowa |  |  | 1993-10-20,2b2e64d0-dc32-4575-ba6c-073f0757f4f9 | Minister Nauki i Szkolnictwa Wyższego (poprzednio MEiN) | 1993-10-20,Działająca | 1993-10-20 ; W likwidacji | 2007-02-02 ; Zlikwidowana | 2023-12-06,zawodowa | 1993-10-20,Schola Posnaniensis - Wyższa Szkoła Sztuki Stosowanej w Poznaniu | 1993-10-20
10f874d0-8a3e-4c56-9148-45391ccab07c,Sieć Badawcza Łukasiewicz - Centralny Ośrodek Badawczo-Rozwojowy Przemysłu Poligraficznego,REPORTS_INSTITUTION,Polska,000274714,167,0,10f874d0-8a3e-4c56-9148-45391ccab07c,,Marlena,,5250008287,http://www.cobrpp.com.pl,,02-227,,226208070,,POLON,Działająca,1,Warszawa,instytut Sieci Łukasiewicz,ul. Zagadki,mazowieckie,1750836907986,,bmXxaqpT4EJCpNtlECSWcfw,5,,7,Polska | mazowieckie | Warszawa | 02-227 | ul. Zagadki |  |  | 1959-12-18,5b64b6e6-7375-4037-89d8-ef183ea2c1f0 | Minister Kultury i Dziedzictwa Narodowego (poprzednio MKDNiS) | 1959-12-18 ; 7d11545b-37fc-4424-8b45-a54a84aad859 | Centrum Łukasiewicz (organ nadzorujący) | 2023-12-01,Działająca | 1959-12-18,instytut badawczy | 1959-12-18 ; instytut Sieci Łukasiewicz | 2023-12-01,Sieć Badawcza Łukasiewicz - Centralny Ośrodek Badawczo-Rozwojowy Przemysłu Poligraficznego | 2023-12-01 ; Centralny Ośrodek Badawczo-Rozwojowy Przemysłu Poligraficznego | 1959-12-18
e9bdbd91-97c4-44aa-945f-834c214f1b61,Sieć Badawcza Łukasiewicz - COBRO - Instytut Badawczy Opakowań,REPORTS_INSTITUTION,Polska,000018572,167,0,e9bdbd91-97c4-44aa-945f-834c214f1b61,,,,5250008778,http://'cobro.org.pl,,02-942,,48 22 842 20 11,,POLON,Przekształcona,4,Warszawa,instytut Sieci Łukasiewicz,ul. Konstancińska,mazowieckie,1750836894935,,bH7Sl9gW2BwnJFdrqRtAzzA,5,,7,Polska | mazowieckie | Warszawa | 02-942 | ul. Konstancińska |  |  | 1974-01-01,b19d0545-dcf0-4f9c-8414-9328e1831c24 | Minister Gospodarki | 1974-01-01 ; ea92a74d-9594-48bf-9e03-4de781cff5b8 | Minister Rozwoju i Technologii (poprzednio MRPiT) | 2015-11-16 ; 53df6a82-2924-4aae-85b7-19106e8bdcf5 | Minister Przedsiębiorczości i Technologii | 2018-01-11,Działająca | 1974-01-01 ; Przekształcona | 2020-01-01,instytut badawczy | 1974-01-01 ; instytut Sieci Łukasiewicz | 2019-04-01,Centralny Ośrodek Badawczo-Rozwojowy Opakowań | 1974-01-01 ; Sieć Badawcza Łukasiewicz - COBRO - Instytut Badawczy Opakowań | 2019-04-01 ; COBRO - Instytut Badawczy Opakowań | 2013-01-02
2cd707c9-2ecf-40e0-868b-1af1db59c602,Sieć Badawcza Łukasiewicz - Górnośląski Instytut Technologiczny,REPORTS_INSTITUTION,Polska,000026867,167,0,2cd707c9-2ecf-40e0-868b-1af1db59c602,,Adam,,6312691891,http://git.lukasiewicz.gov.pl,,44-100,,+48 32 23 45 205,,POLON,Działająca,1,Gliwice,instytut Sieci Łukasiewicz,ul. Karola Miarki,śląskie,1750836894766,0000846236,bR13GLTFVd1JUSfFen3OzVA,5,,12,Polska | śląskie | Gliwice | 44-100 | ul. Karola Miarki |  |  | 1945-04-29,b19d0545-dcf0-4f9c-8414-9328e1831c24 | Minister Gospodarki | 1945-04-29 ; ea92a74d-9594-48bf-9e03-4de781cff5b8 | Minister Rozwoju i Technologii (poprzednio MRPiT) | 2015-11-16 ; 53df6a82-2924-4aae-85b7-19106e8bdcf5 | Minister Przedsiębiorczości i Technologii | 2018-01-11 ; 7d11545b-37fc-4424-8b45-a54a84aad859 | Centrum Łukasiewicz (organ nadzorujący) | 2019-04-01,Działająca | 1945-04-29,instytut badawczy | 1945-04-29 ; instytut Sieci Łukasiewicz | 2019-04-01,Instytut Metalurgii Żelaza im. Stanisława Staszica | 1945-04-29 ; Sieć Badawcza Łukasiewicz - Górnośląski Instytut Technologiczny | 2023-01-01 ; Sieć Badawcza Łukasiewicz - Instytut Metalurgii Żelaza im. Stanisława Staszica | 2019-04-01
75887864-a6ed-43f0-8f4a-1879597282e7,Sieć Badawcza Łukasiewicz - Instytut Biopolimerów i Włókien Chemicznych,REPORTS_INSTITUTION,Polska,000043133,167,0,75887864-a6ed-43f0-8f4a-1879597282e7,,,,7240000138,http://www.ibwch.lodz.pl,,90-570,,42 637 67 44,,POLON,Przekształcona,4,Łódź,instytut Sieci Łukasiewicz,ul. Marii Skłodowskiej-Curie,łódzkie,1750836894921,,bHYlISQlenDKdi_NQrWpL1Q,5,,5,Polska | łódzkie | Łódź | 90-570 | ul. Marii Skłodowskiej-Curie |  |  | 1952-01-01,b19d0545-dcf0-4f9c-8414-9328e1831c24 | Minister Gospodarki | 1952-01-01 ; ea92a74d-9594-48bf-9e03-4de781cff5b8 | Minister Rozwoju i Technologii (poprzednio MRPiT) | 2015-11-16 ; 53df6a82-2924-4aae-85b7-19106e8bdcf5 | Minister Przedsiębiorczości i Technologii | 2018-01-11 ; 7d11545b-37fc-4424-8b45-a54a84aad859 | Centrum Łukasiewicz (organ nadzorujący) | 2019-04-01,Działająca | 1952-01-01 ; Przekształcona | 2022-04-01,instytut badawczy | 1952-01-01 ; instytut Sieci Łukasiewicz | 2019-04-01,Instytut Biopolimerów i Włókien Chemicznych | 1952-01-01 ; Sieć Badawcza Łukasiewicz - Instytut Biopolimerów i Włókien Chemicznych | 2019-04-01
744fe2d4-b33a-4b80-a274-c682d85364eb,Sieć Badawcza Łukasiewicz - Instytut Biotechnologii i Antybiotyków,REPORTS_INSTITUTION,Polska,001208872,167,0,744fe2d4-b33a-4b80-a274-c682d85364eb,,,,5250008347,http://www.iba.waw.pl,,02-561,,+48223786300,,POLON,Przekształcona,4,Warszawa,instytut Sieci Łukasiewicz,ul. Starościńska,mazowieckie,1750836894953,,b8Or1rXSyfcjZR92XiR_XXQ,5,,7,Polska | mazowieckie | Warszawa | 02-561 | ul. Starościńska |  |  | 1985-07-01,b19d0545-dcf0-4f9c-8414-9328e1831c24 | Minister Gospodarki | 1985-07-01 ; ea92a74d-9594-48bf-9e03-4de781cff5b8 | Minister Rozwoju i Technologii (poprzednio MRPiT) | 2015-11-16 ; 53df6a82-2924-4aae-85b7-19106e8bdcf5 | Minister Przedsiębiorczości i Technologii | 2018-01-11 ; 7d11545b-37fc-4424-8b45-a54a84aad859 | Centrum Łukasiewicz (organ nadzorujący) | 2019-04-01,Działająca | 1985-07-01 ; Przekształcona | 2020-06-01,instytut badawczy | 1985-07-01 ; instytut Sieci Łukasiewicz | 2019-04-01,Instytut Biotechnologii i Antybiotyków | 1985-07-01 ; Sieć Badawcza Łukasiewicz - Instytut Biotechnologii i Antybiotyków | 2019-04-01
3e8f9ad6-6157-47db-8e90-d9ba6d2e57d6,Sieć Badawcza Łukasiewicz - Instytut Ceramiki i Materiałów Budowlanych,REPORTS_INSTITUTION,Polska,000056377,167,0,3e8f9ad6-6157-47db-8e90-d9ba6d2e57d6,,Paweł,,5250007626,www.icimb.lukasiewicz.gov.pl,,31-983,,12 683 79 11,,POLON,Działająca,1,Kraków,instytut Sieci Łukasiewicz,ul. Cementowa,małopolskie,1750836895069,0000861078,bs2kih5z0NID4UjAUHeocPQ,5,,6,Polska | mazowieckie | Warszawa | 02-676 | ul. Postępu |  |  | 1951-12-14 ; Polska | małopolskie | Kraków | 31-983 | ul. Cementowa |  |  | 2021-01-22,b19d0545-dcf0-4f9c-8414-9328e1831c24 | Minister Gospodarki | 1951-12-14 ; ea92a74d-9594-48bf-9e03-4de781cff5b8 | Minister Rozwoju i Technologii (poprzednio MRPiT) | 2015-11-16 ; 53df6a82-2924-4aae-85b7-19106e8bdcf5 | Minister Przedsiębiorczości i Technologii | 2018-01-11 ; 7d11545b-37fc-4424-8b45-a54a84aad859 | Centrum Łukasiewicz (organ nadzorujący) | 2019-04-01,Działająca | 1951-12-14,instytut badawczy | 1951-12-14 ; instytut Sieci Łukasiewicz | 2019-04-01,Instytut Ceramiki i Materiałów Budowlanych | 1951-12-14 ; Sieć Badawcza Łukasiewicz - Instytut Ceramiki i Materiałów Budowlanych | 2019-04-01
28588547-04c9-4a2a-ae3c-2396a1a5c7a1,Sieć Badawcza Łukasiewicz - Instytut Chemii Przemysłowej imienia Profesora Ignacego Mościckiego,REPORTS_INSTITUTION,Polska,387049383,167,0,28588547-04c9-4a2a-ae3c-2396a1a5c7a1,,Ewa,,5252836114,https://ichp.lukasiewicz.gov.pl,,01-793,,(22) 568 23 93,,POLON,Działająca,1,Warszawa,instytut Sieci Łukasiewicz,ul. Ludwika Rydygiera,mazowieckie,1750836894794,0000857893,bJ3TFnsyzt4IzpGaw6rSlvQ,5,,7,Polska | mazowieckie | Warszawa | 01-793 | ul. Ludwika Rydygiera |  |  | 1922-05-20,b19d0545-dcf0-4f9c-8414-9328e1831c24 | Minister Gospodarki | 1922-05-20 ; ea92a74d-9594-48bf-9e03-4de781cff5b8 | Minister Rozwoju i Technologii (poprzednio MRPiT) | 2015-11-16 ; 53df6a82-2924-4aae-85b7-19106e8bdcf5 | Minister Przedsiębiorczości i Technologii | 2018-01-11 ; 7d11545b-37fc-4424-8b45-a54a84aad859 | Centrum Łukasiewicz (organ nadzorujący) | 2019-04-01,Działająca | 1922-05-20,instytut badawczy | 1922-05-20 ; instytut Sieci Łukasiewicz | 2019-04-01,Instytut Chemii Przemysłowej im. prof. Ignacego Mościckiego | 1922-05-20 ; Sieć Badawcza Łukasiewicz - Instytut Chemii Przemysłowej imienia Profesora Ignacego Mościckiego | 2019-04-01
bae7be6a-8b71-4488-a60f-cf37c0bf27f1,Sieć Badawcza Łukasiewicz - Instytut Chemii Surowców Odnawialnych,REPORTS_INSTITUTION,Polska,000041631,167,0,bae7be6a-8b71-4488-a60f-cf37c0bf27f1,,Daria,,7492109260,https://www.icso.lukasiewicz.gov.pl/,,47-225,,774873470,,POLON,Działająca,1,Kędzierzyn-Koźle,instytut Sieci Łukasiewicz,ul. Energetyków,opolskie,1769170506200,0000850420,b5nOr06xLd1QOKg4ZZoMmZg,5,,8,Polska | opolskie | Kędzierzyn-Koźle | 47-225 | ul. Energetyków |  |  | 1952-01-01,b19d0545-dcf0-4f9c-8414-9328e1831c24 | Minister Gospodarki | 1952-01-01 ; ea92a74d-9594-48bf-9e03-4de781cff5b8 | Minister Rozwoju i Technologii (poprzednio MRPiT) | 2015-11-16 ; 53df6a82-2924-4aae-85b7-19106e8bdcf5 | Minister Przedsiębiorczości i Technologii | 2018-01-11 ; 7d11545b-37fc-4424-8b45-a54a84aad859 | Centrum Łukasiewicz (organ nadzorujący) | 2019-04-01,Działająca | 1952-01-01,instytut badawczy | 1952-01-01 ; instytut Sieci Łukasiewicz | 2019-04-01,Sieć Badawcza Łukasiewicz - Instytut Chemii Surowców Odnawialnych | 2026-01-01 ; Sieć Badawcza Łukasiewicz - Instytut Ciężkiej Syntezy Organicznej BLACHOWNIA | 2019-04-01 ; Instytut Ciężkiej Syntezy Organicznej BLACHOWNIA | 1952-01-01
10104d5b-8342-476d-a50f-e84ec4c04676,Sieć Badawcza Łukasiewicz - Instytut Elektrotechniki,REPORTS_INSTITUTION,Polska,387388984,167,0,10104d5b-8342-476d-a50f-e84ec4c04676,,Marcin,,5250007684,http://iel.lukasiewicz.gov.pl,,04-703,,22 112 52 05,,POLON,Działająca,1,Warszawa,instytut Sieci Łukasiewicz,ul. Mieczysława Pożaryskiego,mazowieckie,1760429705261,0000857831,b1XGvJiw-TsKhXZq-S51_4g,5,,7,Polska | mazowieckie | Warszawa | 04-703 | ul. Mieczysława Pożaryskiego |  |  | 1946-09-01,b19d0545-dcf0-4f9c-8414-9328e1831c24 | Minister Gospodarki | 1946-09-01 ; ea92a74d-9594-48bf-9e03-4de781cff5b8 | Minister Rozwoju i Technologii (poprzednio MRPiT) | 2015-11-16 ; 53df6a82-2924-4aae-85b7-19106e8bdcf5 | Minister Przedsiębiorczości i Technologii | 2018-01-11 ; 7d11545b-37fc-4424-8b45-a54a84aad859 | Centrum Łukasiewicz (organ nadzorujący) | 2019-04-01,Działająca | 1946-09-01,instytut badawczy | 1946-09-01 ; instytut Sieci Łukasiewicz | 2019-04-01,Instytut Elektrotechniki | 1946-09-01 ; Sieć Badawcza Łukasiewicz - Instytut Elektrotechniki | 2019-04-01
cffc30b5-ce5c-43b7-818e-2e14a5dddb4a,Sieć Badawcza Łukasiewicz - Instytut Farmaceutyczny,REPORTS_INSTITUTION,Polska,000044032,167,0,cffc30b5-ce5c-43b7-818e-2e14a5dddb4a,,,,5250009128,http://www.ifarm.eu,,01-793,,22-456-39-00,,POLON,Przekształcona,4,Warszawa,instytut Sieci Łukasiewicz,ul. Ludwika Rydygiera,mazowieckie,1750836894720,,bv_GUiI1yHQuKV5lqDZKtDw,5,,7,Polska | mazowieckie | Warszawa | 01-793 | ul. Ludwika Rydygiera |  |  | 1951-12-07,b19d0545-dcf0-4f9c-8414-9328e1831c24 | Minister Gospodarki | 1951-12-07 ; ea92a74d-9594-48bf-9e03-4de781cff5b8 | Minister Rozwoju i Technologii (poprzednio MRPiT) | 2015-11-16 ; 53df6a82-2924-4aae-85b7-19106e8bdcf5 | Minister Przedsiębiorczości i Technologii | 2018-01-11 ; 7d11545b-37fc-4424-8b45-a54a84aad859 | Centrum Łukasiewicz (organ nadzorujący) | 2019-04-01,Działająca | 1951-12-07 ; Przekształcona | 2020-06-01,instytut badawczy | 1951-12-07 ; instytut Sieci Łukasiewicz | 2019-04-01,Instytut Farmaceutyczny | 1951-12-07 ; Sieć Badawcza Łukasiewicz - Instytut Farmaceutyczny | 2019-04-01
51edc81e-fdc2-4fa8-8dee-6e2b9177c1af,Sieć Badawcza Łukasiewicz - Instytut Lotnictwa,REPORTS_INSTITUTION,Polska,387193275,167,0,51edc81e-fdc2-4fa8-8dee-6e2b9177c1af,,CEZARY,,1070046338,https://ilot.lukasiewicz.gov.pl/,,02-256,,022 846 00 11,,POLON,Działająca,1,Warszawa,instytut Sieci Łukasiewicz,Aleja Krakowska,mazowieckie,1768817705401,0000862006,bzB5aUdq6Blrs0aqLRRPKlA,5,,7,Polska | mazowieckie | Warszawa | 02-256 | Aleja Krakowska |  |  | 1926-08-01,b19d0545-dcf0-4f9c-8414-9328e1831c24 | Minister Gospodarki | 1926-08-01 ; ea92a74d-9594-48bf-9e03-4de781cff5b8 | Minister Rozwoju i Technologii (poprzednio MRPiT) | 2015-11-16 ; 53df6a82-2924-4aae-85b7-19106e8bdcf5 | Minister Przedsiębiorczości i Technologii | 2018-01-11 ; 7d11545b-37fc-4424-8b45-a54a84aad859 | Centrum Łukasiewicz (organ nadzorujący) | 2019-04-01,Działająca | 1926-08-01,instytut badawczy | 1926-08-01 ; instytut Sieci Łukasiewicz | 2019-04-01,Instytut Lotnictwa | 1926-08-01 ; Sieć Badawcza Łukasiewicz - Instytut Lotnictwa | 2019-04-01
38cc4673-d359-4443-97f2-a81458dcf403,Sieć Badawcza Łukasiewicz - Instytut Materiałów Polimerowych,REPORTS_INSTITUTION,Polska,000044569,167,0,38cc4673-d359-4443-97f2-a81458dcf403,,Marlena,,8790170691,http://www.impib.lukasiewicz.gov.pl,,87-100,,(56) 650-00-44,,POLON,Działająca,1,Toruń,instytut Sieci Łukasiewicz,ul. Marii Skłodowskiej-Curie,kujawsko-pomorskie,1750836916370,0000856159,bkvFYv6VntvqshdfFrpImMA,5,,2,Polska | kujawsko-pomorskie | Toruń | 87-100 | ul. Marii Skłodowskiej-Curie |  |  | 1962-07-01,b19d0545-dcf0-4f9c-8414-9328e1831c24 | Minister Gospodarki | 1962-07-01 ; ea92a74d-9594-48bf-9e03-4de781cff5b8 | Minister Rozwoju i Technologii (poprzednio MRPiT) | 2015-11-16 ; 53df6a82-2924-4aae-85b7-19106e8bdcf5 | Minister Przedsiębiorczości i Technologii | 2018-01-11 ; 7d11545b-37fc-4424-8b45-a54a84aad859 | Centrum Łukasiewicz (organ nadzorujący) | 2019-04-01,Działająca | 1962-07-01,instytut badawczy | 1962-07-01 ; instytut Sieci Łukasiewicz | 2019-04-01,Sieć Badawcza Łukasiewicz - Instytut Materiałów Polimerowych | 2025-04-01 ; Sieć Badawcza Łukasiewicz - Instytut Inżynierii Materiałów Polimerowych i Barwników | 2019-04-01 ; Instytut Inżynierii Materiałów Polimerowych i Barwników | 1962-07-01
e9b87cbb-3ef2-4d2e-9991-c949b830ac36,Sieć Badawcza Łukasiewicz - Instytut Mechaniki Precyzyjnej,REPORTS_INSTITUTION,Polska,000031532,167,0,e9b87cbb-3ef2-4d2e-9991-c949b830ac36,,,,5250009186,http://www.imp.lukasiewicz.gov.pl,,01-796,,22 56020610,,POLON,Przekształcona,4,Warszawa,instytut Sieci Łukasiewicz,ul. Duchnicka,mazowieckie,1750836895054,,bjr9lGatEKQ3lRS-gHNk-cw,5,,7,Polska | mazowieckie | Warszawa | 01-796 | ul. Duchnicka |  |  | 1927-04-22,b19d0545-dcf0-4f9c-8414-9328e1831c24 | Minister Gospodarki | 1927-04-22 ; ea92a74d-9594-48bf-9e03-4de781cff5b8 | Minister Rozwoju i Technologii (poprzednio MRPiT) | 2015-11-16 ; 53df6a82-2924-4aae-85b7-19106e8bdcf5 | Minister Przedsiębiorczości i Technologii | 2018-01-11 ; 7d11545b-37fc-4424-8b45-a54a84aad859 | Centrum Łukasiewicz (organ nadzorujący) | 2019-04-01,Działająca | 1927-04-22 ; Przekształcona | 2023-01-01,instytut badawczy | 1927-04-22 ; instytut Sieci Łukasiewicz | 2019-04-01,Instytut Mechaniki Precyzyjnej | 1927-04-22 ; Sieć Badawcza Łukasiewicz - Instytut Mechaniki Precyzyjnej | 2019-04-01
